[
  {"profile_id":"profile-tw-stock-01","channel_id":"UCvnLmiWt_zIVIh0zUm_j4Hw","sample_video_ids":["vdW1eELwnsk","sgHsCaH2umQ","8GxNAzIg3CM"],"sample_count":3,"status":"PROVISIONAL","hook_patterns":["标题使用可立即回答的投资决策问句","用全压、涨或不涨、倍增等高反差结果压缩问题"],"structure_patterns":["一个核心问题","公司或产品对照","说明区固定风险边界与转化入口"],"evidence_order":["视频内证据顺序 UNAVAILABLE","永久内容应改为先事实后判断"],"pacing":"标题与样本包装偏短促；实际口播节奏 UNAVAILABLE。","uncertainty":"说明区有明确非荐股与损失风险声明，但标题强度高。","cta":"Podcast、来信和投顾会员入口。","anti_patterns":["极端仓位暗示","把播放表现当正确性","没有来源的倍数预测"],"signature_elements_do_not_reuse":["栏目名与固定口号","人物身份语气","原频道宣传句"],"limitations":["只有3条且无字幕/直接观看；画像只覆盖标题与说明层。"]},
  {"profile_id":"profile-tech-01","channel_id":"UCT3uWFvKLVpRnEealmRwvrw","sample_video_ids":["3tAUC5Zg8rw","RolkbaZOwQg","fT4GIObuq-s"],"sample_count":3,"status":"PROVISIONAL","hook_patterns":["开场预告多个科技问题","标题并列三项公司/产业更新","允许公开修正旧判断"],"structure_patterns":["预告","赞助或杂谈","三个长章节","内容库与社群CTA"],"evidence_order":["公司事件或财报","商业解释","长期预期或组织机制","具体来源在视频内是否出现 UNAVAILABLE"],"pacing":"长章节型，多主题切换；真实句长、停顿与重钩子 UNAVAILABLE。","uncertainty":"标题常用问句或自我修正，说明区未观察到统一投资风险声明。","cta":"付费报告、电子报、社群与合作入口。","anti_patterns":["过多前置业配","强度词替代数据","三个主题彼此无共同问题"],"signature_elements_do_not_reuse":["EP编号包装","个人旅行/判断经历","固定赞助结构"],"limitations":["只有3条；依据说明章节，非字幕。"]},
  {"profile_id":"profile-macro-01","channel_id":"UC6LU7FUBvbFCh_cQasrHZ_Q","sample_video_ids":["4gEpLNIRhhk","Iv66HJtx2AY","i_gEGJDcWu8"],"sample_count":3,"status":"PROVISIONAL","hook_patterns":["宏观事件与产业问题同题出现","用能走多远、跟风还是选择等问题保留不确定性","以研究者/指标框架建立可信度"],"structure_patterns":["宏观数据","资金与资产反应","产业/公司差异","下一步指标与风险","报告或服务CTA"],"evidence_order":["数据事件","传导机制","产业基本面","验证指标与条件"],"pacing":"多层级解释与清单摘要；实际句长、停顿与情绪曲线 UNAVAILABLE。","uncertainty":"倾向用问题和待观察指标表达；正式免责声明在样本说明中 UNAVAILABLE。","cta":"研究报告、课程/活动与企业服务。","anti_patterns":["专家身份替代原始来源","从宏观数据直接跳到个股结论","把反弹描述成趋势保证"],"signature_elements_do_not_reuse":["栏目名","来宾职业故事","专属研究产品促销"],"limitations":["只有3条且其中一条是访谈特辑；依据公开说明而非字幕。"]}
]
